{"protocol":"dcc","core":"2","self":"https://gosno.co/api/dcc/routes/DEN-VAIL","id":"gosno.co:route/den-vail","claims":[{"predicate":"route_id","value":"DEN-VAIL","as_of":"2026-01-01T00:00:00Z","evidence":[]},{"predicate":"origin","value":"DEN","as_of":"2026-01-01T00:00:00Z","evidence":[]},{"predicate":"destination","value":"Vail","as_of":"2026-01-01T00:00:00Z","evidence":[]},{"predicate":"direction","value":"OUTBOUND","as_of":"2026-01-01T00:00:00Z","evidence":[]},{"predicate":"vehicle_class","value":"suv","as_of":"2026-01-01T00:00:00Z","evidence":[]},{"predicate":"base_price_cents","value":49900,"as_of":"2026-01-01T00:00:00Z","evidence":[]},{"predicate":"price_formatted","value":"$499.00","as_of":"2026-01-01T00:00:00Z","evidence":[]},{"predicate":"duration_minutes","value":150,"as_of":"2026-01-01T00:00:00Z","evidence":[]},{"predicate":"operational_hold_minutes","value":300,"as_of":"2026-01-01T00:00:00Z","evidence":[]},{"predicate":"rezdy_product_code","value":"PXFGPP","as_of":"2026-01-01T00:00:00Z","evidence":[]},{"predicate":"online_bookable","value":true,"as_of":"2026-01-01T00:00:00Z","evidence":[]}],"state":[{"predicate":"booking_status","value":"accepting_reservations","as_of":"2026-09-12T10:00:04.136Z","fresh_until":"2026-09-12T11:00:04.136Z","evidence":[]},{"predicate":"availability_query_requirement","value":"Specific date and time required for real-time slot reservation","as_of":"2026-09-12T10:00:04.136Z","fresh_until":"2026-09-12T11:00:04.136Z","evidence":[]}],"actions":[{"action_id":"check_availability","method":"GET","target":"https://gosno.co/api/availability","input":{"schema":"https://gosno.co/schemas/availability-v1.json","fields":["origin","dest","date","time","vehicleClass","routeId","tripType","direction","clientCorrelationId"]},"auth":"none"},{"action_id":"create_checkout","method":"POST","target":"https://gosno.co/pay","input":{"schema":"https://gosno.co/schemas/checkout-v1.json","fields":["clientCorrelationId","availabilityToken","origin","dest","routeId","vehicleClass","isRoundTrip","tripType","date","time","customerName","customerEmail","customerPhone","passengerCount","lodgingAddress"]},"auth":"none"},{"action_id":"request_quote","method":"POST","target":"https://gosno.co/api/quote","input":{"schema":"https://gosno.co/schemas/quote-v1.json","fields":["name","phone","email","passengers","origin","destination","outboundDate","outboundPickupTime","tripType","vehicle"]},"auth":"none"}],"links":[{"rel":"operator","target":"gosno.co:org/gosno"},{"rel":"routes_catalog","target":"https://gosno.co/api/dcc/routes"},{"rel":"storefront_page","target":"https://gosno.co/vail"}]}