{"protocol":"dcc","core":"2","self":"https://gosno.co/api/dcc/routes","id":"gosno.co:catalog/routes","claims":[{"predicate":"route_offering","value":{"route_id":"DEN-BRECKENRIDGE","origin":"DEN","destination":"Breckenridge","vehicle_class":"suv","price_cents":39900,"price_formatted":"$399.00","duration_minutes":150,"rezdy_product_code":"P7477S","online_bookable":true},"as_of":"2026-09-11T22:37:33.251Z","evidence":[]},{"predicate":"route_offering","value":{"route_id":"DEN-VAIL","origin":"DEN","destination":"Vail","vehicle_class":"suv","price_cents":49900,"price_formatted":"$499.00","duration_minutes":150,"rezdy_product_code":"PXFGPP","online_bookable":true},"as_of":"2026-09-11T22:37:33.251Z","evidence":[]},{"predicate":"route_offering","value":{"route_id":"DEN-BEAVER-CREEK","origin":"DEN","destination":"Beaver Creek","vehicle_class":"suv","price_cents":54900,"price_formatted":"$549.00","duration_minutes":150,"rezdy_product_code":"P9AP71","online_bookable":true},"as_of":"2026-09-11T22:37:33.251Z","evidence":[]},{"predicate":"route_offering","value":{"route_id":"DEN-KEYSTONE","origin":"DEN","destination":"Keystone","vehicle_class":"suv","price_cents":34900,"price_formatted":"$349.00","duration_minutes":150,"rezdy_product_code":"P9PQRN","online_bookable":true},"as_of":"2026-09-11T22:37:33.251Z","evidence":[]},{"predicate":"route_offering","value":{"route_id":"DEN-COPPER","origin":"DEN","destination":"Copper Mountain","vehicle_class":"suv","price_cents":34900,"price_formatted":"$349.00","duration_minutes":150,"rezdy_product_code":"PHCYQL","online_bookable":true},"as_of":"2026-09-11T22:37:33.251Z","evidence":[]},{"predicate":"route_offering","value":{"route_id":"DEN-WINTER-PARK","origin":"DEN","destination":"Winter Park","vehicle_class":"suv","price_cents":34900,"price_formatted":"$349.00","duration_minutes":150,"rezdy_product_code":"P360K5","online_bookable":true},"as_of":"2026-09-11T22:37:33.251Z","evidence":[]},{"predicate":"route_offering","value":{"route_id":"DEN-STEAMBOAT","origin":"DEN","destination":"Steamboat Springs","vehicle_class":"suv","price_cents":59900,"price_formatted":"$599.00","duration_minutes":180,"rezdy_product_code":"PEZN8V","online_bookable":true},"as_of":"2026-09-11T22:37:33.251Z","evidence":[]},{"predicate":"route_offering","value":{"route_id":"DEN-ASPEN","origin":"DEN","destination":"Aspen","vehicle_class":"suv","price_cents":69900,"price_formatted":"$699.00","duration_minutes":150,"rezdy_product_code":"P11TWN","online_bookable":true},"as_of":"2026-09-11T22:37:33.251Z","evidence":[]},{"predicate":"route_offering","value":{"route_id":"DEN-SNOWMASS","origin":"DEN","destination":"Snowmass","vehicle_class":"suv","price_cents":69900,"price_formatted":"$699.00","duration_minutes":240,"rezdy_product_code":"PP1A72","online_bookable":true},"as_of":"2026-09-11T22:37:33.251Z","evidence":[]}],"state":[{"predicate":"total_published_routes","value":9,"as_of":"2026-09-11T22:37:33.251Z","fresh_until":"2026-09-11T22:52:33.251Z","evidence":[]}],"actions":[{"action_id":"query_route","method":"GET","target":"https://gosno.co/api/dcc/routes/{routeId}","input":{"schema":"https://gosno.co/schemas/route-lookup.json","fields":["routeId"]},"auth":"none"}],"links":[{"rel":"operator","target":"gosno.co:org/gosno"},{"rel":"route_item","target":"https://gosno.co/api/dcc/routes/DEN-BRECKENRIDGE"},{"rel":"route_item","target":"https://gosno.co/api/dcc/routes/DEN-VAIL"},{"rel":"route_item","target":"https://gosno.co/api/dcc/routes/DEN-BEAVER-CREEK"},{"rel":"route_item","target":"https://gosno.co/api/dcc/routes/DEN-KEYSTONE"},{"rel":"route_item","target":"https://gosno.co/api/dcc/routes/DEN-COPPER"},{"rel":"route_item","target":"https://gosno.co/api/dcc/routes/DEN-WINTER-PARK"},{"rel":"route_item","target":"https://gosno.co/api/dcc/routes/DEN-STEAMBOAT"},{"rel":"route_item","target":"https://gosno.co/api/dcc/routes/DEN-ASPEN"},{"rel":"route_item","target":"https://gosno.co/api/dcc/routes/DEN-SNOWMASS"}]}